LINK,TITLE,LOCATION,SALARY,SUMMARY
https://kr.indeed.com/viewjob?jk=15d59eccf1eb06ee,(주)인재아이엔씨 JAVA/JSP 개발자,인재아이엔씨 서울 구로구,,"- 소프트웨어학과 및 전산계열 전공자... W개발 학원 수료자 - 소프트웨어(컴퓨터)공학과, 전자계산학과 등 전공우대 - 정보처리기사, KOSA 자격증 소지자 우대 인터넷·IT·통신·모바일·게임>전산·IT기술지원>S/W 엔지니어"
https://kr.indeed.com/viewjob?jk=0df2999925f12355,Sr. Back-end Engineer (Query Understandi...,Coupang 3.0 서울,,"관련 분야의 학사 학위 * 한 가지 혹은 그 이상의 범용 프로그래밍 언어 ( Java, Python and C/C++)를 사용한 소프트웨어 개발 경험... languages ( Java, Python and C/C++..."
https://kr.indeed.com/viewjob?jk=25b30860cbb49eca,대성홀딩스 정보통신사업부문 정규직,대성홀딩스 대구 동구,"연봉 32,000,000원 - 34,000,000원","개발 및 운영 - 웹, 모바일 시스템 개발 및 운영 2. 필수지식 및 능력 - 프로그래밍 언어(C++, JAVA, 파워빌더 등) 개발 가능자(필수 1개 이상) - 웹 또는 모바일 프로그램 개발 가능자 상세모집요강 접수기간..."
https://kr.indeed.com/viewjob?jk=6db6ce5b7dd6c5da,"[제너지] Java, JSP 정규직",제너지 서울 염창동,"연봉 25,000,000원","무관) [우대사항] - 인근거주자, 운전가능자, 해당직무 근무경험, 문서작성 우수자, 지방근무 가능자 - Java 코딩 스킬 보유자 - 프로그램밍 장기과정이수자 - 고용지원금대상자 우대 - 정보처리기사 - 컴퓨터/시스템공..."
https://kr.indeed.com/viewjob?jk=31e4abde191e6fa8,"신입 개발자 (Java, Android, iOS)",와우인포텍 서울 금천구,"연봉 26,000,000원 - 28,000,000원","루션개발팀 WEB/APP 개발자 ( Java, Android, iOS) 담당... 능하신 분 - Android - Java, Kotlin 가능하신 분 - iOS - Objective-C, Swift 가능하신 분 2. Java Web..."
https://kr.indeed.com/viewjob?jk=86aa031b700fb032,장애인 전산직(임시직) 공개채용 공고,대한결핵협회 서울 우면동,,"협회 내 정보화시스템 유지 보수 등 (자격요건) - 정보처리 기사(산업기사) 자격증 소지자 (선택사항) - JAVA, MS-SQL 가능자 - 전자정부프레임워크 관련 개발 경력과 해당 직무수행 경험자 - 회계 관련 개발..."
https://kr.indeed.com/viewjob?jk=68bff5fe5cec0c61,[멜론] 커머스 개발자 (경력),카카오 4.2 성남 판교역,,서비스 운영/개발 이벤트/프로모션 서비스 운영/개발 타겟마케팅 시스템 운영/개발 지원자격 Linux/ Java/Oracle(Mysql)/Git 기반 B2C 서비스 운영/개발 경력 3년 이상 Springframework...
https://kr.indeed.com/viewjob?jk=83989daa099108d7,"각부문 개발자 및 기술영업, 영업지원 경력자",혁산정보시스템 서울 영등포구,,자격요건 및 우대사항 인원 JAVA 개발 (경력) WEB/APP 개발 웹/앱 서비스 솔루션 개발 [자격요건] JAVA/WEB 개발경력 사원급-3년이상 / 팀장급 -5년이상 [우대사항] JAVA 기반 웹/앱 서비스 개발가능...
https://kr.indeed.com/viewjob?jk=3f6927d7deff4480,"[정규직] Web(프론트엔드, 백엔드) 신입 / 경력 프로그래머",루트링크 안양 동안구,,게임>웹프로그래머>JSP|인터넷·IT·통신·모바일·게임>응용프로그래머> JAVA|인터넷·IT·통신·모바일·게임>웹프로그래머>PHP |인터넷·IT·통신... 통신·모바일·게임>웹프로그래머> JAVA|인터넷·IT·통신·모바일·게임>웹프...
https://kr.indeed.com/viewjob?jk=af2e3a7abee953c0,프로그래머(Java·JSP 신입 경력),인클루드시스 서울 연남동,"연봉 24,000,000원",모집직종 JAVA 프로그래밍 언어 전문가 모집인원 2명 학력 관계없음 전공 고용형태 상용직 근무예정지 서울특별시 마포구 월드컵북로8길 21 인클루드빌딩 3층(연남동) 인근지하철 직무내용 담당업무 - 웹 시스템 개발 및 유지...
https://kr.indeed.com/viewjob?jk=24640a0080f9bc5e,"Java개발자(정규직,프리랜서)",기업형솔루션 서울,,"12년이상), 중급엔지니어(대졸기준 5년이상. 초대졸기준 7년이상) -나이/성별 : 무관 -Skill : Java가능하신분. 정보연계 개발경험, DB무관(Oracle,Cybase등) [전형절차] -서류전형 -1,2차면접..."
https://kr.indeed.com/viewjob?jk=5a0b53c0cc23d9a7,"Senior, Database Engineer (Storage Platf...",Coupang 3.0 서울,,"우대 사항: * 프로그래밍 및 스크립트 스킬 (bash, Python, Java, Go 선호) * 다양한 종류의 데이터베이스 경험 ( MySQL... skills (bash, Python, Java, Go preferred..."
https://kr.indeed.com/viewjob?jk=e787fde04b998e1a,이상탐지팀 - 서비스 개발자,Nexon 성남 분당구,,"하는 API 개발 - AWS 인프라 구축 및 운영업무 지원자격 - python, node.js, C#, Java등 한 가지 이상의 언어를 능숙히 사용 가능하신 분 - 관련 분야 5년 이상 경력 - AWS 클라우드 아키..."
https://kr.indeed.com/viewjob?jk=0796ab14d94d5f24,유니티 개발자 찾습니다.,플링크 청주 청원구,"월급 1,900,000원","담당자 정보보기] 주황색 부분을 클릭하면,확인하실 수 있습니다. 인터넷·IT·통신·모바일·게임>응용프로그래머>C·C++|인터넷·IT·통신·모바일·게임>응용프로그래머> JAVA|인터넷·IT·통신·모바일·게임>응용프로그래머>C#"
https://kr.indeed.com/viewjob?jk=cb7151fe5bc020a2,"JAVA, MySQL 외 신입/경력 정규직",아톰앤비트 서울 서초구,,"퓨터/시스템공학 영어가능자 컴퓨터활용능력 우수자 아톰앤비트 주식회사 JAVA, MySQL 외 신입/경력 정규직 채용 모집부문 및 자격요건 담당... 통신·모바일·게임>웹프로그래머> JAVA|인터넷·IT·통신·모바일·게임>데이..."
https://kr.indeed.com/viewjob?jk=4bca629c9e11e552,"[개발]자연어처리(NLP, 텍스트마이닝) 개발자(정규직)",위메프 2.3 대한민국,,언어처리 / 기계학습 관련 알고리즘에 능숙한 자 [우대사항] - 자연언어처리 분야 석사 이상 - 중급 이상 Java 개발 능력 보유자 - 한국어 NLP / NLU 개발 경력자 - 보훈대상자(국가유공자)는 관련 법률에 의거...
https://kr.indeed.com/viewjob?jk=38116599d85a42ec,[시스템 엔지니어] 콜센터 솔루션 구축 신입,디오티스 서울 강남구,,자격면허] - 정보처리기사 [장애인채용희망여부] 비희망 [병역특례] - 비희망 [기타 우대내용] - JAVA 플랫폼 개발 관련 경험자 - 컴퓨터/시스템공학 전공 인터넷·IT·통신·모바일·게임>전산·IT기술지원>IT기술지원
https://kr.indeed.com/viewjob?jk=bf64bff2c2347d3e,[해외취업] 오사카 종합기술직,엘트리 대한민국,"연봉 28,000,000원 - 72,000,000원","개발/프로그래밍/테스트 ・네트워크, 서버의 도입, 구축·운용 관리 ・업무계 시스템 개발/프로그래밍/테스트 · JAVA를 이용한 어플리케이션 개발/프로그래밍/테스트 등 화학계 엔지니어 ·연구개발 ·유기·무기합성 ·실험 등..."
https://kr.indeed.com/viewjob?jk=f492396f4c172df4,[경력/3년이상] 욕심많고 꿈이 있는 프로그래머 찾습니다.,위더스이십일 서울 금천구,,게임>웹프로그래머>JSP|인터넷·IT·통신·모바일·게임>응용프로그래머> JAVA|인터넷·IT·통신·모바일·게임>웹프로그래머>PHP |인터넷·IT·통신... 통신·모바일·게임>웹프로그래머> JAVA|인터넷·IT·통신·모바일·게임>웹프...
https://kr.indeed.com/viewjob?jk=7b2d3912d5a1ae9f,"[해외취업] 일본 SDP Java개발, 인프라구축 사원",SDP 대한민국,"연봉 24,000,000원 - 72,000,000원",무관 자격면허 외국어능력 필수 일본어(중) : 업무와 관련하여 의사소통 가능자 주요업무내용 1.웹개발 엔지니어 Java、JSP、JavaScript、Ajax、XML、HTML、CSS、Eclipse、 Servlet、Spring...
https://kr.indeed.com/viewjob?jk=0114b51ed877e22f,[해외취업] IT 엔지니어 정사원,CAL 대한민국,"연봉 27,000,000원 - 40,000,000원","엔지니어(IT계열) *사용언어（ Java、JSP、C언어 등) *실무경험은... 연수후에는, OJT를 통하여 사내의 영업지원 툴 작성을 교육합니다. Java、JSP、C언어 등을 사용한 오픈계열의 어플리케이션의 개발을 실시합니다..."
https://kr.indeed.com/viewjob?jk=1d93be07a2472fea,웹 개발 경력자,삼일씨티에스 성남 중원구,,"지원양식 커리어 온라인 이력서 전형절차 및 제출서류 전형절차 직무/산업 직무별(직종) 웹프로그래머웹프로그래머, JSP, JAVA, MySQL 응용프로그래머Oracle 산업별(업종) 건축.인테리어.설비.환경 건축설비, 기계"
https://kr.indeed.com/viewjob?jk=80f1a9fe40a6c290,[Search & Clova] 파파고 Software Engineer 경...,네이버 대한민국,,Papago Server 팀의 Software E ngineer 로서 아래의 역할을 수행하게 됩니다 . - Java/Node.js/Flask 백엔드 서버 개발 / 운영 - 시스템 설계 및 Performance Tuning...
https://kr.indeed.com/viewjob?jk=6b993940cd492320,[신입] 기업부설연구소 소프트웨어 개발자,위트소프트 부산 해운대구,,[직무내용] 엔지니어링 소프트웨어 개발 - C# / JAVA / Oracle DB / MS-SQL - 프로그램 연구개발 구인내역 - 신입 1명 - 경력 1명(2 ~ 3년) [근무시간 및 형태] 주 5일 근무 (오전) 9시...
https://kr.indeed.com/viewjob?jk=fbf8fd872d668700,[롯데글로벌로지스] 물류연구소 연구원 특별채용,롯데 서울,,"물류분석시스템 개발(IT개발) 물류운영 관련, 분석시스템 개발 업무 JAVA 및 Oracle 개발자 JAVA 및 Oracle 프로젝트 수행 경력 5년 이상 JAVA 및 Oracle SQL Tool 사용 및 개발 가능자(필수..."
https://kr.indeed.com/viewjob?jk=107a2a8b4b0fc479,"응용소프트웨어 (C#, JAVA , JSP) 개발 가능자",유니에버 경상북도 구미,"연봉 24,000,000원 - 26,000,000원","지원자격 경력 신입·경력 학력 - 성별 무관 기타 담당업무 - ERP / MES / POP 개발 - PM 및 개발 - C#, Power builder 상세모집요강 접수기간/방법 지원방법 전형절차 및 제출서류 제출서류..."
https://kr.indeed.com/viewjob?jk=05e98fd73c648f99,"웹 개발자 Java,JSP/PHP 웹개발자 정규직",서원 대전 유성구,"연봉 22,000,000원 - 24,000,000원",게임>웹프로그래머>JSP|인터넷·IT·통신·모바일·게임>응용프로그래머> JAVA|인터넷·IT·통신·모바일·게임>웹프로그래머>PHP |인터넷·IT·통신... 통신·모바일·게임>웹프로그래머> JAVA|인터넷·IT·통신·모바일·게임>웹프...
https://kr.indeed.com/viewjob?jk=694647881aeef509,Business System Analyst,Amway Inc. 서울,,"functionalities and features... main Web browsers, HTML, Java, JSP and other web-based technologies. Be proficient..."
https://kr.indeed.com/viewjob?jk=c3f341e754015d45,2020년도 쿠팡 경력 개발자 공개채용 (Android / iOS),Coupang 3.0 서울,,"개발 경험 3년 이상인 분 - Android Mobile application 개발 경험이 있으신 분( Java, Kotlin, Gradle 등) - 서비스 개선에 대한 열의와 적극적 태도가 있으신 분 [iOS개발자..."
https://kr.indeed.com/viewjob?jk=7dd9260545826817,프로그램 개발(JAVA) 전문가,IZYTECH(이지텍) 서울 성동구,"연봉 24,000,000원","모집직종 JAVA 프로그래밍 언어 전문가 모집인원 2명 학력 전문대학 전공 고용형태 상용직 근무예정지 서울특별시 성동구 왕십리로 인근지하철 직무내용 웹개발 및 모바일개발/웹개발 경력자 2~10년이상, JAVA, DB(Ms..."
https://kr.indeed.com/viewjob?jk=ca8b391536a5c333,[해외취업] 일본 주식회사 COMSENS 신입 및 경력사원,COMSENS 대한민국,"연봉 34,180,000원 - 85,450,000원","JLPT N2 주요업무내용 시스템 개발업무 ( 요건정의, 기본설계, 상세설계, 제조(코딩), 테스트 ) - JAVA, .NET(ASP, VB), UNIX C/C++ 등 - 그 외 자격요건 Ⅰ. 모집직종, 인원 및 응시자격..."
https://kr.indeed.com/viewjob?jk=01de6a64eda302fe,카카오맵 장소 서버 개발자,카카오 4.2 성남 판교역,,"커뮤니케이션 능력과 타인을 배려하는 마음 개발에 대한 열정과 새로운 도전을 즐기는 자세 #우대 자격 JAVA 개발 경험 RDBMS를 이용한 개발 경험 (MySQL, Oracle, PostgreSQL 등) Spatial..."
https://kr.indeed.com/viewjob?jk=037ef0714c5ef074,[충남형 지역균형발전 청년고용사업 신청기업]소프트웨어 프로그래머,비제이월드 천안 동남구,"연봉 24,000,000원 - 26,000,000원","지원자격 경력 신입·경력 학력 - 성별 무관 기타 담당업무 - JAVA, SPRING, frameWORK 기반 반응형 웹 제작 및 유지보수 -내부서버 관리 상세모집요강 접수기간/방법 지원방법 전형절차 및 제출서류 제출서류..."
https://kr.indeed.com/viewjob?jk=73bcd214387a7c69,JAVA개발 및 웹개발 경력자,몽땅뚝딱 안양 동안구,,"[직무내용] 모집분야 : JAVA/PHP관련 업무개발 및 웹서비스 개발... 담당업무 - HTML5, Java-script 를 활용한 웹 개발이 가능하신분 (jQuery, Vu.js 등) - Java Spring 기반 개발을..."
https://kr.indeed.com/viewjob?jk=2123ac5cf266fd4e,[신입] 대기업관공서 JAVA 프로그래머,루트시스템즈 서울 성북구,"연봉 30,000,000원","터공학 , 전산학·컴퓨터공학 고용형태 상용직 근무예정지 서울특별시 성북구 동소문로 3층 인근지하철 직무내용 JAVA 전산 개발 경력조건 신입 필요경력 자격면허 1 정보처리기사 병역 병역 특례 무관 외국어 능력 컴퓨터 활용..."
https://kr.indeed.com/viewjob?jk=089931931a0474d5,소형전지사업부 경력,삼성SDI 3.9 충청남도 천안,,"SECS, HSMS 통신 프로그램 개발 천안 전공분야 - 컴퓨터, 산업공학 시스템 관련 전문지식 - JAVA, C# - Oracle 10g 이상(PL/SQL) - 통신프로그래밍 경험자 지원방법 - 삼성채용..."
https://kr.indeed.com/viewjob?jk=d414d702649a6bd5,JAVA 프로그래머 수시-가산디지털단지역,연우정보기술 서울 강남구,,연우정보기술(주) 모집부문 및 자격요건 담당업무 자격요건 인원 JAVA 프로그래머 모집 [자격요건] 경력사항: 경력(3년 이상 12년 이하... 통신·모바일·게임>웹프로그래밍> JAVA|인터넷·IT·통신·모바일·게임>웹프...
https://kr.indeed.com/viewjob?jk=385c58c7ced1d77b,데이터 사이언티스트 지향하는 데이터 엔지니어,카카오 4.2 성남 판교역,,"Hive, Spark 등 빅데이터 분석 플랫폼을 사용하여 대용량 데이터의 수집,가공이 가능한 분 프로그램 개발( Java, python 등) 기술을 보유하신 분 직무 관련 경력 2년 이상 어떤 일이라도 중요하게 여기며 책임감..."
https://kr.indeed.com/viewjob?jk=2b2ee3fa7ba0ca89,NEXACRO 개발자,국내 유명 한식프랜차이즈 인천 부평구,,"4000~5000 • 경력 5년 이상 • 자격요건 - Nexacro 개발 경력 3년 이상 - JSP, JAVA, 자바스크립트, MS-SQL 개발 경력자 - ERP 개발 및 유지보수 경력자 - 전산 관련 경력 및 자격증..."
https://kr.indeed.com/viewjob?jk=92c79e97ed68ff0b,[엠브레이스] 시스템 & Web 풀스텍 개발자,엠브레이스 서울 구로구,"연봉 32,000,000원 - 34,000,000원","력서 등록하기 지원양식 커리어 온라인 이력서 전형절차 및 제출서류 전형절차 직무/산업 직무별(직종) 웹프로그래머웹프로그래머, JAVA 응용프로그래머응용프로그래머, Java 산업별(업종) 솔루션.ASP.소프트웨어 소프트웨어개발"
https://kr.indeed.com/viewjob?jk=7d85150a375cfacf,[Search & Clova] BigData and AI Platform...,네이버 대한민국,,필수조건] - Java / Python / C / C++ 개발 가능 (경력사원의 경우 1년 이상의 경력) - 리눅스 환경에서의 개발 경험 - 우수한 문제 분석 및 해결 능력 [우대요건] - Scala / Go / Java...
https://kr.indeed.com/viewjob?jk=842b81b319e55e7e,네이버 지식iN eXpert 서비스 백엔드 개발자,네이버 대한민국,,개발 - Quality Practice (a.k.a 애자일 프랙티스 및 기술 실천법) [필요역량] - Java 기반 백엔드 프로그래밍 기본 지식을 보유하신 분 - 개발 표준 수립 및 구현 전략이 가능하신 분 - Spring...
https://kr.indeed.com/viewjob?jk=15bfd0ccb9e9dbde,"3d게임 엔지니어, 디자이너",토마토브이알하우스 서울,,"유니티엔진, 언리얼엔진,C#,C++, Java,포토샵 등) 지원방법... 명시 (사용가능한 툴과 언어 기입 : 유니티엔진, 언리얼엔진,c#,c, java,포토샵 등) - 제출서류는 일체 반환하지 않음 마감일 채용시 전형..."
https://kr.indeed.com/viewjob?jk=039f22821b155ec5,비펌즈코리아에서 웹디자인영역의 새로운 인재,비펌즈코리아 경기도 화성,"월급 2,000,000원 - 2,200,000원","오후5시 지원자격 : 해당 업무 관련 경력 종사자 우대 전반적인 웹디자인 / 웹 퍼블리싱 / CSS / JAVA / JSP / HTML / 포토샵 / 일러스트 경력자 복리후생 : 연금,산재,고용,건강 - 4대보험, 중식제공..."
https://kr.indeed.com/viewjob?jk=add71a2887615954,웹 개발자(신입),이롭게 서울특별시,,"담당업무 웹서비스 프로그래밍 필수사항 Java 웹 프로그래밍 관련 기술에 대한 이해( Java, HTML/css/javascript) Spring Framework 기술에 대한 이해 우대사항 컴퓨터공학/과학 또는 전자계산학..."
https://kr.indeed.com/viewjob?jk=2456d7ea425c3765,"JAVA 프로그래머 (Java, Spring프레임워크)",아르고넷 대전 유성구,,"지원자격 경력 신입·경력 학력 학력무관 성별 무관 기타 담당업무 JAVA 프로그래머 ( Java, Spring프레임워크) 커리어 양식 지원 아직 커리어에... 직종) 웹프로그래머웹프로그래머, JAVA 산업별(업종) 솔루션.ASP.소프..."
https://kr.indeed.com/viewjob?jk=b82cdf579d90192f,교통과학연구원 계약직,도로교통공단 대한민국,,"계약기간 전문계약직 라급 1 수치지도 개발 - GIS Tool을 활용한 어플리케이션 개발 유경험자/ JAVA, Visual C++ 사용 가능자/CNS 단말기 프로그램 개발 유경험자 서울시 공단본부(8개월) - 우대사..."
https://kr.indeed.com/viewjob?jk=b02431aa362a3acb,[TmaxData/기술] DB 엔지니어(대구),티맥스소프트 대구,,"성격 보유자 우대사항 컴퓨터 및 전산관련 전공자 DB, CDC 제품 기술지원 및 운영업무 유경험자 C/ Java 기반의 SQL 개발 유경험자 OCP/SQLP(SQLD)/DAP(DAsP) 자격증 IT기술 교육 및 업무..."
https://kr.indeed.com/viewjob?jk=d57b19564ea05138,데이터인프라개발팀 - 데이터 플랫폼 엔지니어,Nexon 성남 분당구,,"지원자격 - 클라우드 환경에서 분산 시스템을 시작부터 운영까지 스스로 개발해본 분 - C++ / C# / JAVA / Scala / Python 언어 중 한가지 이상의 언어를 능숙히 사용하시는 분 - 자료구조, 알고리즘..."
https://kr.indeed.com/viewjob?jk=d9acd7e11c3fdc65,[유펜솔루션] 웹 크롤러 개발자,유펜솔루션 서울 강남구,"연봉 24,000,000원",이터 수집 자동화 설계 - 크롤링 엔진 개발 및 고도화 - 백엔드/프론트에드와의 통신 체계 구축 필요역량 - Java or C/C++ or Python을 이용한 웹 크롤러 개발 경력 - 상기 언어에 대해 최소 2년 이상 개발...
https://kr.indeed.com/viewjob?jk=ecd6fb1a0fe8a06b,Solutions Engineer Manager (APAC),SendBird 서울,,"programming language... JavaScript, Swift, Objective C, Java, Kotlin, or C# * You have working knowledge... least one..."
https://kr.indeed.com/viewjob?jk=89703a2ec473e2d9,2020년도 지역정착형 청년일자리 사업 -컴퓨터 ...,에스파킹 경기도 부천,,모집직종 JAVA 프로그래밍 언어 전문가 관련직종 기타 정보통신기기 설치·수리원 직무내용 1. 사업계획서 작성 2. 컴퓨터 프로그램 개발지원 3. 주차관제 시스템 유지관리 4. 거래처 견적 영업지원 *첨부파일 참조바랍니다...
https://kr.indeed.com/viewjob?jk=b255530651a0d66d,Java개발자.시니어급,온라인결제 서울,,"[담당업무] -핀테크 인증 서버 개발 [자격요건] - Java기반 개발 경력 6년이상 -Spring Framework 3.x 이상 개발 경험 -Oracle, MySQL 등 RDBMS 경험 -리눅스 환경 개발 경험 [우대요건..."
https://kr.indeed.com/viewjob?jk=f42e0319fe7afbe9,응용 S/W 개발 및 운영 경력자,아큐라소프트 경기도 이천,,개발 및 운영 (C# / .Net / Java / Javascript... 취소될 수 있습니다. 인터넷·IT·통신·모바일·게임>응용프로그래머> JAVA|인터넷·IT·통신·모바일·게임>응용프로그래머>.NET|인터넷·IT·통신...
https://kr.indeed.com/viewjob?jk=1a33a9c8b9904546,[해외취업] 고급 IT 엔지니어,株式会社ASCOM 대한민국,,"중개 소프트, AP, I 프리미엄 기술자 일본어 능력은 상관없음. python,C++,C,C#,ASP.net, JAVA,VB.net,swift,IOS,Android,kotlin 중 한가지 이상 개발 경력이 3년 이상인 자..."
https://kr.indeed.com/viewjob?jk=a7ad2455872da832,[카카오스토리] 개발자 (서버/iOS/Android),카카오 4.2 대한민국,,"드로이드 클라이언트 개발 지원자격 Java, Kotlin 개발 2년 이상... 업무내용 카카오스토리 서버 개발 및 운영 지원자격 Java 서버 개발 2년 이상 Java Spring framework를 이용한 서버 개발 경험..."
https://kr.indeed.com/viewjob?jk=412f4a4caf6af454,개발자,체인지포인트 서울 송파구,,"1. 경력 3년 이상의 풀스택 혹은 백엔드 개발자 2. 자기소개서 및 포트폴리오 자료 3. 파이썬, JAVA 능통하신 분 C++, JSP, SPRING 능통하신 분 (우대) 급여 연봉 3,000만원~3,500만원"
https://kr.indeed.com/viewjob?jk=49bb83246aaaa60c,함께 성장할 S/W개발자 모집합니다.,주식회사 유락 전라북도 완주,"연봉 24,000,000원 - 26,000,000원","일(40시간)근무 지원자격 : 프로그램 코딩 가능자 프로그램 언어 무관( C, C++, Python, Java 등) 담당업무 : S/W개발 담 당 자 : 김용진 010-7446-1120 yongjinin@yourock..."
https://kr.indeed.com/viewjob?jk=3b97b2bc736cf50d,"웹프로그램(JAVA, JSP) 개발자 채용 경력...",엔유비즈 광주 서구,,모집직종 웹 개발자(웹 엔지니어·웹 프로그래머) 관련직종 JAVA 프로그래밍 언어 전문가 직무내용 JAVA 웹기반 업무 개발 접수마감일 채용시까지 고용형태... 개발자 ] [웹 ] [자바 ] [ JAVA ] [소프트웨어 ] 우대사항 우대...
https://kr.indeed.com/viewjob?jk=db5d56d844ae0ac7,"솔루션 개발, 금융 프로젝트 si",비티웍스 경기도,,로젝트 si 응모자격 * 자격 요건 - 학력 : 대졸이상 (4년) - 경력 : 3년 이상 - 대상 : JAVA 기반 프로그래밍 가능자 * 우대 - 금융 프로젝트 유경험자 * 담당업무 - 솔루션 개발 - 금융...
https://kr.indeed.com/viewjob?jk=d6a8c94c11ae048e,Sr. Android Engineer (Android Engineerin...,Coupang 3.0 서울,,"Application 개발 경험: Java, Kotlin, Gradle... development: Ability to get familiar with Java, Kotlin, Gradle, RxAndroid, Glide..."
https://kr.indeed.com/viewjob?jk=cd8d778824409f88,플랫폼 서비스 개발 및 운영/CRM시스템 개발 경력사원 모집,지에스아이티엠GSITM 군산 장재동,,"자격요건 · 모바일/웹 환경을 위한 API 시스템 개발 경험 · Java, Spring Framework, 전자정부프레임워크 · Linux... 기술 이해 · Oracle, Java, Spring Framework..."
https://kr.indeed.com/viewjob?jk=5ad17fb19a5e874e,2020년도 지역정착형 청년일자리 사업 -컴퓨터 프로그램어 및 스마트 폰...,에스파킹 경기도 부천,"월급 1,800,000원","모집직종 JAVA 프로그래밍 언어 전문가 모집인원 2명 학력 고등학교 전공 제어계측공학 , 전자공학 고용형태 상용직(시간제) 근무예정지 경기도 부천시 석천로 쌍용3차부천테크노파크 301동 303-12호 인근지하철 직무내용..."
https://kr.indeed.com/viewjob?jk=fe6046ddc1f7c18b,P2P 대출 시스템 기획,휴먼디지털 서울,,"업체 업무내용 P2P 대출 사내 전산시스템 구축 자격조건 은행,증권사 사내 전산 시스템 구축 경력자 C++, Java 프로그램 가능자 근무지 서울 연봉 회사내규에따름 모집기간 채용시 마감 전형방법 서류전형 후 면접 지원서류..."
https://kr.indeed.com/viewjob?jk=527ede840149154c,가상화폐 프로그래머,휴먼디지털 서울,,"트코인,알트코인 등 가상화폐 개발 - C++,Python, Java 등 프로그램 개발 자격조건 - 비트코인,알트코인 등 가상화폐 개발 가능자 - C++,Python, Java 등 프로그램 개발 경력 2년 이상자 - 가상화폐 매매..."
https://kr.indeed.com/viewjob?jk=29667656675b70f2,RPA 및 DevOps ALM 엔지니어,시와소프트 서울 금천구,"연봉 30,000,000원 - 35,000,000원","DevOps ALM 사용자 우대 ( Git,SVN. Jenkins ) - java 개발 경험 우대 시와소프트(주) RPA 및 DevOps ALM... SVN. Jenkins ) - java 개발자 우대 [우대사항] 자격증..."
https://kr.indeed.com/viewjob?jk=ecefc1515958e88c,일반보험 프로젝트 PM 및 분석/설계 인력 ( 지원마감 ),IT 솔루션 전문업체 서울,,"대졸 이상 손해보험사 일반보험 시스템 개발 경력자 (PM은 경력 10년 이상, 분석/설계자는 경력 8년 이상) Java 가능자 차세대 경험자 우대 [전형절차] 서류전형, 면접 2회 [제출서류] 이력서, 경력 및 자기소개서..."
