LINK,TITLE,LOCATION,SALARY,SUMMARY
https://kr.indeed.com/viewjob?jk=604de7caa5f65310,"Specialist Solutions Architect III, Anal...",Amazon Web Services Korea LLC 서울,,"least one or more programing languages... Python, Java and Scala. · Hands on experience leading large-scale global data..."
https://kr.indeed.com/viewjob?jk=b2cfcc7d4b79c216,[Search&Clova] Clova 챗봇 Platform 개발 신입/경...,네이버 대한민국,,"머신러닝 모델의 서비스화 [ 자격요건] - 기술 경험 · Scala/ Java 등으로 웹 어플리케이션 또는 이에 지식과 경험 · DB Schema... Programming Skill · Java, Scala, Spark..."
https://kr.indeed.com/viewjob?jk=b6f6a789b6e7a028,"[Search & Clova] Entity Linking, Keyword...",네이버 대한민국,,"문서 내 중요 키워드 추출 · 검색 키워드 추천 필요 역량 · 리눅스 쉘 프로그래밍 역량 · Python, Java, C 중 하나에 뛰어난 프로그래밍 역량 · 대용량 분산처리 플랫폼 (Hadoop, Spark etc ) 의..."
https://kr.indeed.com/viewjob?jk=f4f75cd44bccd322,시스템/ICT 생명보험 계정계 분석/설계/개발 경력사원,한화시스템/ICT 서울 여의도역,,"신계약(가입설계, 청약, 인수심사) 분석, 설계 및 개발 [자격요건] JAVA/JavaScript/CSS/HTML5/SQL 및 Spring F/W... 설계 및 개발 [자격요건] JAVA/SQL 개발 경험을 보유하신 분..."
https://kr.indeed.com/viewjob?jk=0a9b39c74fc68103,시스템/ICT 재무경영 ITO 경력사원,한화시스템/ICT 서울 여의도역,,"스템 개선을 위한 제안 및 사용자 커뮤니케이션 활동 - 내부 프로젝트에 대한 개발 및 업무 지원 [자격요건] Java Developer, HTML / JSP 경험 보유하신 분 오라클 SQL, PL-SQL 관련 경험 보유하..."
https://kr.indeed.com/viewjob?jk=55a19c92c845685e,Developer / Designer recruit,마이뮤직테이스트 서울 논현동,,"i.e Python, Ruby, Java, .Net etc... testing - Test environment management - JAVA or Python - Intermediate knowledge..."
https://kr.indeed.com/viewjob?jk=3dbaa2a79cca59cc,한국보건복지정보개발원 인력,서울특별시 5.0 대한민국,,"5년 이상 경험자 - Jsp, Java, Miplatform, DBMS... 자 - Oracle 유경험자 - ASP, JSP, JAVA, XLM, JAVA Script 유경험자 - Unix/Linux/Windows..."
https://kr.indeed.com/viewjob?jk=736eb193e417cee2,비즈개발실 서버 개발자,카카오 4.2 대한민국,,party와 소통하며 플랫폼 생태계를 구축합니다. (지원자격 Java 분야) Java & Spring Framework 기반 웹서비스 개발 경험... 지를 개발합니다. (지원자격) Java 기반 웹 서비스 개발 경력 3년...
https://kr.indeed.com/viewjob?jk=92bd400e3b5306ba,[Search & Clova] Clova AI 인재,네이버 대한민국,,"Python, Golang, Java Spring, node.js 등... Animation 같은 iOS 프레임웍을 폭넓게 사용해본 경험 (iOS) Java, Kotlin 능숙하게 사용 (Android) Android..."
https://kr.indeed.com/viewjob?jk=b79c2ae536063b01,[전문연구요원] 상시,네이버 대한민국,,"Javascript, CSS, HTML 에 능숙 ㅇ HTTP / REST / API 설계에 익숙하신 분 ㅇ JAVA / Go / NodeJS 중 1개 이상의 프로그래밍 언어에 익숙하신 분 ㅇ LINUX OS ㅇ Docker..."
https://kr.indeed.com/viewjob?jk=f935130f920e7f66,"1,2월 경력",LG CNS 3.7 서울,,"정산, 네트워크) 구축/운영 ② Java 또는 C/C++ 프로그램 개발... 웨어/ JAVA Application Framework 솔루션 개발(미들웨어/Framework 솔루션 기획, 개발, 기술지원 등) 필수요건 ① Java..."
https://kr.indeed.com/viewjob?jk=2e1223277a2dbfe9,KDI국제정책대학원 직원(전산2팀),KDI국제정책대학원 세종특별자치시,,2) KDI국제정책대학원에서 3개월 이상 근무한 인턴 경력자(현장실습생 제외) 가점 부여 나. 해당 분야 1) JAVA 및 DBMS 경험자 우대 2) 공공기관 대상 정보보안 업무 실무경력자 우대 전형단계별 채용정보 전형단계별...
https://kr.indeed.com/viewjob?jk=93596c684023eea6,[던파모바일2D] 웹개발자,네오플 서울 강남구,,"긍정적인 협업 태도와 업무에 열정을 가지신 분 우대사항 - 게임 로그 데이터 처리 경험 - Node.js/ Java를 이용한 웹서버개발 실무 경험을 보유하신 분 기타사항 - 서류 검토 기간은 최대 한달이며, 개별적으로 결과..."
https://kr.indeed.com/viewjob?jk=5a3704a451412c98,(상시) 인공지능 플랫폼 전문가,에셋플러스자산운용 대한민국,,"로세스 구축 및 운영 -Linux / My SQL 운영 및 관리 경력자 우대 -Python / C/C++ / JAVA 등 데이터 분석 및 처리관련 개발언어 숙련자 우대 -API, Scraping 등 활용 데이터 수집, 운영관..."
https://kr.indeed.com/viewjob?jk=bf30e666b1966b96,리조트/호텔 시스템 운영 경력사원,한화시스템 서울 영등포구,,숙박·음식·미용·보안>호텔·숙박>리조트운영관리|인터넷·IT·통신·모바일·게임>네트워크·서버·보안>네트워크구축·운영·관리|인터넷·IT·통신·모바일·게임>응용프로그래머> JAVA|인터넷·IT·통신·모바일·게임>웹프로그래머>JSP
https://kr.indeed.com/viewjob?jk=00ae55555e6992ba,[TmaxData/기술] Data 기술지원 엔지니어,티맥스소프트 서울,,"성격 보유자 우대사항 컴퓨터 및 전산관련 전공자 DB, CDC 제품 기술지원 및 운영업무 유경험자 C/ Java 기반의 SQL 개발 경력 유경험 OCP/SQLP(SQLD)/DAP(DAsP) 자격증 IT기술 교육 및..."
https://kr.indeed.com/viewjob?jk=088e29135443a6db,금융그륩 BSP 시스템 개발 업무,"국내 유명 금융그룹 / 대표 금융특화 기업집단으로서 저축은행, 캐피탈, 대부업 위주 사업 서울 중구",,"금융권 IT실무 (여신, 채권, 할부 등) 개발 경험자 컴퓨터 아키텍쳐 지식을 가진 자 프로그램 언어( JAVA, C 등) 개발 경험자 Framework 환경(Anyframe), UI개발툴(Miflatform)개발 경험자..."
https://kr.indeed.com/viewjob?jk=eeb027369cdab361,분석 플랫폼 웹 프론트 엔지니어,Nexon 성남 분당구,,"Javascript 등 웹어플리케이션 개발을 위한 front-end 개발 가능 - Node, Python, C#, Java 중 최소 1개 언어에 대한 경험이 있는 분 - SQLServer, Mysql과 같은 RDBMS..."
https://kr.indeed.com/viewjob?jk=fa190cab482a619b,이마고웍스㈜에서 웹 개발자,이마고웍스 서울 동대문구,"연봉 30,000,000원 - 32,000,000원","절차 및 제출서류 제출서류 이력서에 응시분야, 연락처, 희망연봉 기재 직무/산업 직무별(직종) 콘텐츠.사이트운영디버깅 웹프로그래머웹프로그래머, ASP, JSP, JAVA, Servlet, CORBA, PHP, CGI, XML"
https://kr.indeed.com/viewjob?jk=ce6747e77c861c46,Data Scientist,Boston Consulting Group 4.2 서울,,"plus, Programming... scripting exp.: eg. Python, C#, VBA, Java, Perl, etc. Experience in applied analytics for business..."
https://kr.indeed.com/viewjob?jk=92cbd6a1cb691822,JAVA개발자,엔텔스 서울 강남구,,"력서 전형절차 및 제출서류 전형절차 직무/산업 직무별(직종) 웹프로그래머웹프로그래머, JAVA 응용프로그래머응용프로그래머, 전산전공, Java 시스템프로그래머시스템프로그래머 산업별(업종) 솔루션.ASP.소프트웨어 소프트웨어개발"
https://kr.indeed.com/viewjob?jk=0bee193bca624351,"웹, C/S 개발자 (C#, ASP.NET, Java, Spring) 정...",디포커스 서울 성동구,,"성별 무관 기타 담당업무 웹, C/S 개발자 (C#, ASP.NET, Java, Spring) 정규직 채용 커리어 양식 지원 아직 커리어에 이력서를... 웹프로그래머웹프로그래머, ASP, JAVA, .NET 응용프로그래머응용프로..."
https://kr.indeed.com/viewjob?jk=d5d0d006337d6b14,프론트 개발자 / 플래시 html5작업자,이루미에듀테크 서울 송파구,"월급 1,000,000원","(주)이루미에듀테크 | 교육서비스 | 플래시,HTML·코딩, java,웹프로그래머 | 아르바이트,계약직,위촉직 | 1주일~1개월 | 월~금 | 오후근무 | 건당 1,000,000 | 연령무관 | 2020-02-24"
https://kr.indeed.com/viewjob?jk=950e6cdcb170eb20,[전액무료]천안/서울/수원 IT교육받고 취업하자(빅데이터/개발/디자인),휴먼교육센터 수원 장안구 +1 지역,"월급 1,800,000원","휴먼교육센터 | 직업훈련기관 | HTML·코딩,CSS,jsp, java,서버관리,시스템프로그래머,IT·디자인 기타 | 08 | 6개월~1년 | 월~금 | 조일근무 | 월급 1,800,000 | 연령무관 | 2020-03-03"
https://kr.indeed.com/viewjob?jk=3e89fc011b4c832e,Service Engineer,ABB 4.0 서울,,license is preferred. Proficient in programming language ( Java preferred). Proven ability to work in a team or independently...
https://kr.indeed.com/viewjob?jk=b73eb91bde0e211d,아이포트폴리오 영어교육 콘텐츠 개발업무 대체인력(육아휴직),아이포트폴리오 서울 중구,"일당 84,240원","형절차 및 제출서류 제출서류 이력서에 응시분야, 연락처, 희망연봉 기재 직무/산업 직무별(직종) 응용프로그래머MFC 게임기획.개발.운영베타테스터, Flash게임, Java게임, 모바일앱게임, 온라인게임, 게임개발, 멀티미디어"
https://kr.indeed.com/viewjob?jk=0c32265fe4f353d8,네이버 일본 맛집 서비스 CONOMI Backend 개발자,네이버 대한민국,,"를 활용한 검색 개발 - 서비스 운영을 위한 관리툴 및 Batch Job 개발 [ 필요 역량 ] - Java or Kotlin 언어에 능숙하며 , Spring Boot 를 활용할 수 있으신 분 - Junit / Spock..."
https://kr.indeed.com/viewjob?jk=2c6a303484ece76b,우리요 iOS 앱개발자,우리요 서울,"연봉 40,000,000원 - 42,000,000원","희망연봉 기재 (제출된 서류는 일체 반환되지 않음) 직무/산업 직무별(직종) 응용프로그래머응용프로그래머, Java, ActiveX, 아이폰, 안드로이드, Application 산업별(업종) 모바일.무선 모바일, 모바일App..."
https://kr.indeed.com/viewjob?jk=fb617eeb80ea6fa9,AI/빅데이터 분야 (인재 Pool),LG유플러스 3.8 서울,,"scikit-learn/Tensorflow 등) 능숙자 . Deep Learning Model 구현 경험자 . Java, Python등을 이용하여 분석을 위한 Data Manipulation (전처리, 분석 마트생성 등)경험..."
https://kr.indeed.com/viewjob?jk=ce4e9da1806dbc5d,[EY한영] 경영지원본부 IT팀 개발자 신입~경력직 모집,EY 4.0 대한민국,,Shooting 과 함께 글로벌 IT 직원들과 협업하여 다양한 IT 프로젝트를 진행하는 업무를 수행 합니다. JAVA Web 개발 Javascript 및 jquery 지원자격 및 우대사항 전공 : 전공무관...
https://kr.indeed.com/viewjob?jk=f2f9d7e5c715ec11,[EY컨설팅] 컨설팅본부(Advisory) Java 개발자 경력직 모집,EY 4.0 대한민국,,"가지고 탁월한 고객 서비스를 제공하고 있습니다. 모집 분야 : [EY컨설팅] 컨설팅본부(Advisory) Java 개발자 경력직 모집 지원자격 자바를 사용할 줄 알고, 객체 지향 언어에 대한 이해가 있으신 분 전산학에..."
https://kr.indeed.com/viewjob?jk=d9a8d22b38653d34,[인재풀] Central Development Services,Electronic Arts 서울,,"기능을 바르게 파악하고 품질 향상을 위한 프로세스 및 도구를 제안 및 구현할 수 있는 능력 - C++, C#, Java, Object C 등의 프로그래밍 언어 및 Python, Shell Scripts, Ruby 등 스크립팅..."
https://kr.indeed.com/viewjob?jk=915d3762ee523104,"[국내중견금융그룹] Java, Spring, Jsp의 개발자",FN executive search 서울,,"search JAVA, Spring, Jsp개발자 채용 모집부문 및 자격요건 담당업무 자격요건 인원 [담당업무] - 플랫폼 서비스(앱/웹) 기획 및 운영 관리 [자격요건] (필수조건) - Java, Spring 프레..."
https://kr.indeed.com/viewjob?jk=7e51e3f8157cffd0,(주)올랜즈 온라인쇼핑몰 프로그래머,올랜즈 성남 분당구,"월급 3,500,000원","(주)올랜즈 | 생활용품 도소매,수출,수입,프렌차이즈 | asp,jsp,php, java,VB,서버관리,네트워크관리,웹프로그래머,응용프로그래머,시스템프로그래머 | 정규직,계약직 | 6개월~1년 | 월~금 | 조일근무 | 월급 3..."
https://kr.indeed.com/viewjob?jk=398c9731c6b6aacc,보험사 일반보험시스템 운영개발(JAVA/11개월/강남),디와이즈 서울 강남구,,"졸업(2,3년) 성별 무관 기타 담당업무 보험사 일반보험시스템 운영개발( JAVA/11개월/강남) 자유 양식 지원 개인이 현재 보유중인 이력서 자유양... 산업 직무별(직종) 응용프로그래머 Java 산업별(업종) SI.SM.ERP..."
https://kr.indeed.com/viewjob?jk=95e9900e16b547e2,서울특별시 노원구 일반임기제공무원,서울특별시 5.0 대한민국,,"사람 * 관련분야 경력 인정범위 : 민간 및 공공기관 S/W 개발 경력 【우대사항】 Oracle, Java, HTML5 프로그램밍 분야에서 2년이상 개발 경력이 있는 자 ※ 상위 임용등급에 규정된 자격기준을 충족한..."
https://kr.indeed.com/viewjob?jk=0243408adc9c2a17,"국비무료 취업교육생 (빅데이터/자바개발자, 웹디자인/웹퍼블리셔)",한국직업전문학교 서울 구로구,"일당 160,000원","한국직업전문학교 | 직업훈련 | 컴퓨터학원 | 08 | 3개월~6개월 | 월~금 | 조일근무 | 일급 160,000 | 연령무관 | 2020-02-25"
https://kr.indeed.com/viewjob?jk=4edbdaebae7b2b60,IT부문 경력직,하나펀드서비스 대한민국,,"환경 경험자 2) 소프트웨어(SW) 엔지니어 (1) 업무내용 - Java 기반 어플리케이션 프레임워크 관리 및 기능 개선 - 미들웨어 (WEB... 이션 개발 및 운영 경험자 - Java, Python, bash, Node..."
https://kr.indeed.com/viewjob?jk=1dc86da6653d71f7,금융그륩 금융지원 EDW시스템,"국내 유명 금융그룹 / 대표 금융특화 기업집단으로서 저축은행, 캐피탈, 대부업 위주 사업 서울 중구",,"BusinessObjects), Dashboard(Xcelsius), DBMS(Sybase IQ) 및 Portal ( Java) 개발 유경험자(중급이상), 금융권 IT헬프데스크(전산지원업무 등) 운영가능자 - 우대: Data..."
https://kr.indeed.com/viewjob?jk=d6c05c588971df5a,백엔드 파운트 시스템 엔지니어 (현재 급여수준 이상 보장),파운트 서울 충정로역,,"능숙 우대사항 - Python, Java등을 이용한 프로그래밍 경험 네트... 명령어 및shell스크립트 작성 능숙 우대사항 - Python, Java등을 이용한 프로그래밍 경험 네트워크및 서버에 대한 표준화및 운 표준 구성..."
https://kr.indeed.com/viewjob?jk=0d6f3abea2436b48,네이버 블로그/포스트 Android 개발자,네이버 대한민국,,"서비스 Android 개발 및 운영 [필요역량] - Android 개발 경험을 1년 이상 보유하신 분 - JAVA, Kotlin 기본 개발 역량을 보유하신 분 - Android Custom View와 Animation에..."
https://kr.indeed.com/viewjob?jk=c6398dbbd3c4f4d9,"Partner Engineer, Google Assistant",Google 4.3 서울,,"one or multiple programming languages... C++, Java, JavaScript, Typescript or Python. Preferred qualifications..."
https://kr.indeed.com/viewjob?jk=2615f45e6f912c05,"Customer Solutions Engineer, Global Clie...",Google 4.3 서울,,"coding in a general purpose programming language (e.g., Java, C/C++, Python). Preferred qualifications: Experience..."
https://kr.indeed.com/viewjob?jk=5d0af321fe085616,네이버 O2O서비스 개발자,네이버 대한민국,,"pll - 일본 맛집 서비스 필요 역량 - 아래 기술 중 1가지 이상을 능숙하게 다루실 수 있는 분 [ java, react, react native, node.js, mongodb, elasticsearch, mysql..."
https://kr.indeed.com/viewjob?jk=67ca30c143379281,Data Scientist III,Amazon Web Services Korea LLC 서울,,"experience in software development in languages like Java, Python, Scala. Experience working with RESTful API and general..."
https://kr.indeed.com/viewjob?jk=f3a14b3f8d9e3e12,네이버 쇼핑검색플랫폼 개발자,네이버 대한민국,,"info extraction [필요역량] - 아래 기술 중 어느 한가지를 능숙하게 다룰 수 있는 분 [ Java, Python, Spring boot/batch/cloud, Kotlin, React, Vue, Node.JS..."
https://kr.indeed.com/viewjob?jk=67d626ca09b630e3,NXLog리포트팀 - 웹 프로그래머,Nexon 성남 분당구,,"데이터를 연동하고 외부에 전달하기 위한 API를 개발합니다. * 팀의 기술 스택 - Language : Java, TypeScript, JavaScript - Framework : Spring Boot, Angular..."
https://kr.indeed.com/viewjob?jk=91a809e078e7b215,[피파온라인4] 모바일클라이언트 엔지니어,Electronic Arts 서울,,"공학 또는 관련 계열 전공자 전문적인 C++ 사용능력 전문적인 Object-C, Swift 사용능력 전문적인 Java, Kotlin 사용능력 OOP, Design Pattern 들에 대한 이해 및 사용 Ant빌드 사용 경험..."
https://kr.indeed.com/viewjob?jk=b533d685d31cb4f6,데이터 엔지니어,RIDI Corp 서울,,"파이프라인 구축 및 운영 경험 GA, Tableau 등 외부 분석/시각화 도구에 대한 지식 Python, Java, Scala 중 하나 이상을 이용한 개발 경험 [지원 시 유의 사항] 이름, E-mail, 연락 가능한..."
https://kr.indeed.com/viewjob?jk=d80b7c49e9de5584,Technology Senior Consultant-CX,SAP 4.3 서울,,architecture/design At least 2 years of experience with Java/ Java Web/J2EE Experience in front end and framework technologies...
https://kr.indeed.com/viewjob?jk=9c63fea8a3b83a00,개발 총괄 PM,비플러스랩 대한민국,,"기반 웹앱 개발 및 운영 경험 (Angular, React, Backbone 등) (우대) 앱개발 경력 - Java(Android SDK) 개발 경험 or Objective-C, Swift 개발 경험 4. 우대사항 컴퓨터..."
https://kr.indeed.com/viewjob?jk=01bc879744c28f9c,Support Engineer _ Azure PaaS,Microsoft 4.2 서울,,"one or more languages or frameworks: Java, Node, Python, PHP and Ruby, .NET Core... NGNIX, Apache, Java, Node, Python, PHP..."
https://kr.indeed.com/viewjob?jk=3854c464fd2b228f,웹/모바일 개발자,이액션 서울 영등포구,"연봉 22,000,000원 - 24,000,000원","PC 기반 S/W 개발자 분들을 모집합니다. Web 프로그램 개발자 ( Java 기반) .NET 프로그램 개발자 (C#.net 등) Android... 그래머웹프로그래머, ASP, JSP, JAVA, Servlet, CORBA..."
https://kr.indeed.com/viewjob?jk=b19575486d134ab7,BR&T Software Engineer Intern,BOEING 서울,,"Strong software development skills using Python, C, C++, Java, and Javascript etc (Preferred) Knowledge on aerospace..."
https://kr.indeed.com/viewjob?jk=f9ef2605d7a04e5b,1boon 서비스 웹 개발자 (백엔드 및 프론트엔드),카카오 4.2 제주도,,kakao.com/_STxkxbu) 지원자격 [기본 자격] 제주 근무 가능자 개발 경력 2년 이상 Java 또는 Javascript 개발 역량 필수 원활한 커뮤니케이션 능력과 타인을 배려하는 마음 개발에 대한 열정과...
https://kr.indeed.com/viewjob?jk=5d75add82fd315fb,유니메오 함께할 웹개발 인재 찾습니다.,유니메오 서울 서초구,"연봉 25,000,000원","개발 [필요기술] - 서버 WEB 개발 JAVA 및 서버 통신 모듈 개발 경력 - JAVA/JSP - JAVA SPRING BOOT - JAVA SPRING FRAMEWORK - AJAX JQUERY, JAVA-SCRIPT..."
https://kr.indeed.com/viewjob?jk=cb79f173fd9cf6cc,[하이브랩] 경력직 AEM 개발자,하이브랩 성남 분당구,,"등록하지 않으셨다면!! 상세 이력서 등록하기 지원양식 커리어 온라인 이력서 전형절차 및 제출서류 전형절차 직무/산업 직무별(직종) 웹프로그래머웹프로그래머, JAVA 산업별(업종) 웹에이전시 웹에이전시, 웹에이전시, 웹프로덕션"
https://kr.indeed.com/viewjob?jk=5dbdc4cfd49392ea,네이버 쇼핑플랫폼 Selective 앱 개발자 (Android/iOS),네이버 대한민국,,"필요역량] * Android * - Android 개발 경험을 2년 이상 보유하신 분 - Kotlin, JAVA 기본 개발 역량을 보유하신 분 - Android Framework에 대한 이해도가 높으신 분 - Git 사용에..."
https://kr.indeed.com/viewjob?jk=04d685fc70b67d4e,Linux/Python/PHP/MySQL/백엔드 정규직 경력,일루미나리안 용인 보정동,,"End 서버를 개발해 보신 분 [우대사항] - Go(aka GoLang), Swift, Android( Java), PHP, Angular - DB 이해도가 높고, SQL 관련 전문지식이 있으신 분 - 대기업 근무 경험 및..."
https://kr.indeed.com/viewjob?jk=03d4a37e5b037835,프로그래밍 엔지니어,디코 천안 서북구,"연봉 27,600,000원 - 33,000,000원",기타 희망내용] 충남형 지역균형발전 청년고용사업 신청기업 인터넷·IT·통신·모바일·게임>응용프로그래머>C·C++|인터넷·IT·통신·모바일·게임>응용프로그래머> JAVA|인터넷·IT·통신·모바일·게임>응용프로그래머>C#
https://kr.indeed.com/viewjob?jk=3ffc7a22768918e4,[해외취업] 게임 개발자 / 사원 40%가 외국국적 글로벌 근무환경,엘트리 대한민국,"연봉 35,000,000원 - 100,000,000원","분 영어로 의사소통이 가능하신 분 최신 테크놀로지나 기술 트랜드에 흥미가 있는, 배우고 싶은 분 환영스킬 C++/C#/ Java/python 개발경험 서버 개발 3D게임 개발 네트워크 시스템 개발 모집공고 URL https..."
https://kr.indeed.com/viewjob?jk=d0870bd5fc51abc9,스마트팩토리 부문 응용/웹 개발자,지오넥스 안양 동안구,"연봉 25,000,000원","모집직종 JAVA 프로그래밍 언어 전문가 모집인원 2명 학력 관계없음 전공 전산학·컴퓨터공학 , 산업공학 고용형태 계약직 (기간 3개월) 근무예정지 경기도 안양시 동안구 벌말로 평촌역하이필드지식산업센터 A동 1504호 인근지..."
https://kr.indeed.com/viewjob?jk=383d4c8a7156b52b,[카카오 클라우드] 플랫폼 포털 개발자,카카오 4.2 성남 판교역,,"서비스 개발 업무. 지원자격 [기본 조건] 개발 경력 3년 이상 웹서비스를 구성하는 기술에 대한 이해 Java, JavaScript, Python 중 한 가지 언어를 능숙하게 사용할 수 있으신 분 [우대사항] 프론..."
https://kr.indeed.com/viewjob?jk=cd53e929fc0f6ce3,웹 퍼블리셔/Front-End 개발자/Back-End 개발자 직원,리시드 서울 성동구,"연봉 25,000,000원","기본 지식이 있으신 분 3.Back-End 개발자(대리~과장급) - 관련분야 경력 3년 이상이신 분 - JAVA, PHP 등 개발언어 활용 능력이 있으신 분 - 웹서버 관리 및 운영이 가능하신 분 - Full-Stack..."
https://kr.indeed.com/viewjob?jk=c7724b1dc7c9a322,JAVA/JSP 개발자 모집(신입/경력/정규직),블루라임커뮤니케이션즈 서울 삼성동,,라자 1523호 JAVA/JSP 개발자 모집(신입/경력/정규직) 모집부문 및 자격요건 모집부문 담당업무 및 자격요건 모집인원 JAVA/JSP 개발자... 년) 이상 - 성별/연령 : 무관 - JAVA/JSP 개발 우대사항...
https://kr.indeed.com/viewjob?jk=2aa898393deb8097,모바일 앱 Engineer (React Native/React),Soomgo 서울 강남구,,"협업을 잘 하실 수 있는 분 우대사항 • 모바일 네이티브 언어(Swift, Objective C, JAVA) 개발 경험이 있는 분 • 상용 모바일 앱 개발 및 출시 경험이 있는 분 • 속도 향상을 위한 최적화에 대한..."
https://kr.indeed.com/viewjob?jk=37f9180a5ed0543a,개발 담당자,지오비전 강원도 춘천,,등에 대해 배울 수 있는 기회 제공 - 대학원 석사 과정 지원 인터넷·IT·통신·모바일·게임>응용프로그래머>C·C++|인터넷·IT·통신·모바일·게임>응용프로그래머> JAVA|인터넷·IT·통신·모바일·게임>응용프로그래머>C#
https://kr.indeed.com/viewjob?jk=52f597a457b3e61f,백엔드 개발자( 경력 2년이상) 분,시지온 서울 동교동,,Redis Git Java Spring Node.js 자격 조건 서비스에 따라서 다른 기술 스택으로 운영되고 있습니다. 따라서 하기 2가지 조건 중 1가지는 반드시 만족을 해야 합니다 Java/Spring 실무 경험...
https://kr.indeed.com/viewjob?jk=0ebde768f98f227f,서버 프로그래머,펀플로 서울 구로구,,"서버는 Java 기반입니다. 게임 서버는 Linux , Cache 는 Redis 입니다. 현재 안드로이드와 ios 두 os 를 지원하기에 Java 와... 기본 지식 보유 [우대 조건] Java Spring Framework..."
https://kr.indeed.com/viewjob?jk=0655c9aea2cf5b1e,"앱(IOS,안드로이드), 웹(자바스프링,JSP,PHP) 개발자 및 디자이...",웹비즈 서울 송파구,"연봉 24,000,000원","모집직종 웹 개발자(웹 엔지니어·웹 프로그래머) 모집인원 3명 학력 관계없음 전공 고용형태 상용직 근무예정지 서울특별시 송파구 송파대로 문정역테라타워 A동 인근지하철 직무내용 안드로이드, 아이폰, 앱개발, 하이브리드앱..."
https://kr.indeed.com/viewjob?jk=707559b03d7a26fc,동영상서비스/플랫폼 서버개발자,카카오 4.2 성남 판교역,,"키울 수 있습니다. 업무내용 카카오의 동영상 서비스 및 동영상 플랫폼 개발 지원자격 #기본조건 Java 개발 1년 포함, 총 개발 경력 3년 ~ 7년 Spring Framework 기반 웹 애플리케이션 개발 경험이..."
https://kr.indeed.com/viewjob?jk=930a6a7d80e095bc,Cloud Support Engineer - Developer and M...,Amazon Web Services Korea LLC 서울,,one... following languages: · Python · Ruby · PHP · Java · .NET (C#) · JavaScript · iOS (Objective-C / Swift) · Linux...
https://kr.indeed.com/viewjob?jk=bba1b00eadbfeda3,[API플랫폼/FE플랫폼팀] 프론트엔드 경력 개발자,카카오 4.2 성남 판교역,,"경력 3년 이상 ES2015+의 이해 HTML, CSS의 이해 React 프레임워크 환경 실무 경험자 우대 Java, Playframework(Scala) 경험자 우대 인앱브라우저 환경 개발 경험자 우대 ※ 카카오 기술..."
