LINK,TITLE,LOCATION,SALARY,SUMMARY
https://kr.indeed.com/viewjob?jk=fd5f1b793e29282f,[TOP신용카드사] 보험 플랫폼 기획 및 개발 (과장-차장급),FN executive search 서울,,"경력 8년 이상 - 선진사/보험사/인슈테크사 경력(대행사 포함) - Java, JavaScript, AnyFrame, Oracle, jQuery... 웹사이트운영·테스터|인터넷·IT·통신·모바일·게임>웹프로그래머> JAVA"
https://kr.indeed.com/viewjob?jk=3de38c3158a1e498,[W마인드실]백엔드 개발자(정규직),위메프 2.3 대한민국,,"기반에서 백엔드 서버 개발 및 로그 서비스 운영 [자격사항] - Spring 환경 개발 경험 3년 이상자 - Java 프로그래밍 언어에 대한 이해도가 높은 자 - RESTful API 개발 경험자 - MySQL, NoSql..."
https://kr.indeed.com/viewjob?jk=39834f5337a56072,Sr. Data Architect - Data Lakes & Analyt...,Amazon Web Services Korea LLC 서울,,"software code in one or more programming languages ( Java, JavaScript, Python, etc). · Current hands-on implementation..."
https://kr.indeed.com/viewjob?jk=7fb2bd5ced012a2e,리스크관리팀 공개 (신입),메리츠종합금융증권 대한민국,,"대사항 - 외국어(영어) 활용능력이 우수한 자 - FRM 등 금융관련 자격증 소지자 - VBA, C++, JAVA 프로그래밍 가능자 근무환경 근무형태 : 연봉계약직 근무시간 : 08:00~17:30 (휴게시간..."
https://kr.indeed.com/viewjob?jk=63011090ab296ac0,백엔드 개발자 찾습니다 신입/경력 무관,레인써클 서울 영등포구,,"[웹프로그래밍] - jsp, java, ASP / PHP 개발 능숙자 - HTML, JavaScript, css 능숙자 - MS SQL, Oracle, MySQL 등 DBMS 설계 및 운영 가능자 - 웹, DB서버 구축 및..."
https://kr.indeed.com/viewjob?jk=f496043772d6a536,시스템/ICT 리조트/호텔 시스템 운영 경력사원,한화시스템/ICT 서울 여의도역,,"ITO) 또는 프로젝트 참여 경험 보유하신 분(4년 이상) 프로그램 개발 경력 보유하신 분(4년 이상) JAVA, JAVA SCRIPT, JSP 사용 경험 보유하신 분(4년 이상) Oracle 11g, PL/SQL 구현 능력..."
https://kr.indeed.com/viewjob?jk=dcda50f281a517f9,[Platform Engineering] Server Engineer,네이버 대한민국,,개발 및 운영 • 필요역량 (아래 관련 경력 2년 이상) ㅇ HTTP / REST / API 설계에 익숙하신 분 ㅇ JAVA / Go / NodeJS 중 1개 이상의 프로그래밍 언어에 익숙하신 분 • 우대사항 ㅇ LINUX...
https://kr.indeed.com/viewjob?jk=e010f7780d479126,검색서비스 서버 개발 신입/경력,포티투마루 서울 봉천동,,"가능) - 성별 : 무관 - 모집인원 : 0명 [기술 지원자격] - Linux 환경 개발 경력 - C/ Java/Python 개발 경력 - 서버 개발/운영 경력 [우대사항] - 자연어처리, 정보검색, 기계학습..."
https://kr.indeed.com/viewjob?jk=21f720e55bab4c8d,카카오톡 서버 개발자,카카오 4.2 성남 판교역,,"양한 앱서버와 DB, 캐시, MQ 등으로 구성된 시스템을 설계하고 주로 Java, Kotlin / Spring 프레임웍을 기반으로 하는 앱서버를 개발... 원자격 우대 사항 ✓ Spring/ Java 혹은 Spring/Kotlin..."
https://kr.indeed.com/viewjob?jk=b0ddf23c918e8129,"AppDynamics Senior Sales Engineer, Seoul",Cisco Systems 4.1 서울,,"least one... following languages: Java, .NET, PHP, JavaScript. Experience... common Java web application architecture..."
https://kr.indeed.com/viewjob?jk=600acd8e652a71de,신입8년차,매직소프트 서울 성수동,,"Java, Javasciprt, Srping,ExtJs 기반의 ERP 솔루... e포인트 최대 20만원) 매달 간식박스 명절 선물 연구소에 소속되어 Java 8, Spring4, myBatis 기반의 인사, 근태, 급여, 회계..."
https://kr.indeed.com/viewjob?jk=9ec6ee8ffbdef537,Client Solutions Engineer,Cover Genius 서울,,"experience. 3+ years programming experience in Python, Java, or PHP. 2 years of experience with web technologies... HTTP..."
https://kr.indeed.com/viewjob?jk=6cc4ad3e37ceabe1,Java 백엔드 개발자,TEAM42 서울 마포구,,"프로젝트 서버 개발 지원 자격 - Java 기반의 서버 개발 경력이 있거나, 그에 준하는 실력이 있으신 분 - MySQL을 비롯한 RDBMS 설계 및 운영에 조예가 깊으신 분 우대 사항 - Java 기반 서버 프레임워크 실무..."
https://kr.indeed.com/viewjob?jk=e339b300b84379be,[룰루랩-삼성전자c-lab] 백엔드 서버 개발자 경력,룰루랩 서울 강남구,,"이상 - 성별 : 무관 - 모집인원 : 1명 [직무우대역량 (지식, 스킬, 태도)] - Java Spring F/W, Java Spring Boot, JPA (필수) - AWS 개발환경 (필수) - 3년 이상의..."
https://kr.indeed.com/viewjob?jk=b7154df9a72f40b3,"[현장코칭 숙련인원 양성사업] 중앙부처 대표홈페이지 개발자(java, J...",애니스마트 전주 완산구,,"[웹프로그래밍] -전산,컴퓨터,정보처리 전공자 우대 인터넷·IT·통신·모바일·게임>웹프로그래밍> JAVA|인터넷·IT·통신·모바일·게임>웹프로그래밍>JSP"
https://kr.indeed.com/viewjob?jk=696ab68f98e6e993,"직원 (IT본부,금융컨설팅본부,평가사업본부,마케팅본부)",KIS채권평가 대한민국,,"IT_프로그래머> *포지션: 신입/경력 *담당업무: - 프로그래머 *자격요건: - C/C++, C#, java 등 프로그램 개발 가능 - Oracle Database 이용 경험 - Windows server와 Linux 환경..."
https://kr.indeed.com/viewjob?jk=1b1299c220e39220,Test Operator (Field Testind/Driver) (일어...,글로벌모터서비스 서울 강남구,,"suite of tools, primarily Jira and Confluence is desirable - JAVA, C++ [ Location ] Tokyo 23 wards/Kawasaki [ Duration..."
https://kr.indeed.com/viewjob?jk=3190803dba63c314,동영상 데이터/비즈 플랫폼 서버 개발자,카카오 4.2 성남 판교역,,"동영상 비즈 플랫폼 개발 동영상 광고 서버 개발 동영상 데이터 수집/분석 지원자격 기본 조건 Java 개발 경력 2년 이상 Spring Framework 기반 웹 애플리케이션 개발 경험 MySQL, MongoDB 등의..."
https://kr.indeed.com/viewjob?jk=2d5c603043556b81,Marketing Science Director,KANTAR 3.7 서울,,"ideally in different languages... Python, Hadoop, R, Java, Ruby, Matlab, Pig or SQL Passionate about clients; exploring..."
https://kr.indeed.com/viewjob?jk=466cc59b5da7ca88,시스템/ICT 포털 시스템 운영 경력사원,한화시스템/ICT 서울 여의도역,,"솔루션 운영 - Java Spring F/W, JSP, view.js 기반 웹서비스 개발 및 유지보수 - SSO/EAM 연계 개발 및 솔루션 운영 - JSON 기반 포틀릿 I/F 개발 [자격요건] JAVA 개발 경력 보유하..."
https://kr.indeed.com/viewjob?jk=b51ca785a45edf17,Senior Specialist Consultant - AI/ML,Amazon Web Services Korea LLC 서울,,"experience in software development in languages like Java, Python, Scala. Experience working with RESTful API and general..."
https://kr.indeed.com/viewjob?jk=404d0fae05d91c73,미들웨어 운영,(주)에이블씨엔씨 서울 서초구,,운영... DB 시스템 모니터링 및 튜닝/장애지원 [자격요건] - 관련경력 8~12년 - Java개발... Web / DB / APM 구축 및 운영 경험 필수 - DB튜닝 및 EXADB 운영경험자...
https://kr.indeed.com/viewjob?jk=99d1b2e25887707d,기술 지원 및 개발 가능한 Technical Su...,이포넷 서울 삼성동,,"내용 담당직무 - JAVA 웹기반 관리 시스템 개발 및 유지 보수 - 업무 자동화 프로그램 (Python) - 번역 부서 관련 인트라넷( Java) 및... 가능) - JAVA, WEB Programming Java Spring..."
https://kr.indeed.com/viewjob?jk=25e69880bf9fc9dd,SW 프로그래머 (신입/경력),천명소프트 서울,,"- JAVA, C 개발 가능자 - 전공(정보통신, 컴퓨터공학 외) - 자격증(정보처리산업기사 또는 정보처리기사 자격 취득자) 인터넷·IT·통신·모바일·게임>웹프로그래머> JAVA"
https://kr.indeed.com/viewjob?jk=1419df24ce0d0cda,컴퓨터학원 강사 파트 및 전임 모심,아람컴퓨터전문학원 서울 동작구,"월급 1,000,000원","곳으로 더 알려져 있어 대학을 목표로 학생들을 지도 하고 있습니다. 분야를 좀더 넓혀 프로그램분야(c,c++, java,안드로이드,모바일,앱개발 등등), 그래픽분야(웹디자인)등을 지도 하고자 강사분을 채용하고자 합니다. 3..."
https://kr.indeed.com/viewjob?jk=3e2a310c9dd0f693,[멜론] 빅데이터 서비스 개발자,카카오 4.2 성남 판교역,,"등)을 활용한 데이터 시각화 서비스 개발 지원자격 Spring Framework 개발 경력 3년 이상 Java 언어 능숙 자료구조, 알고리즘, OS, 네트워크, SQL의 기초 지식 보유 긍정적이고 원활한 커뮤니케이션..."
https://kr.indeed.com/viewjob?jk=5814ac1fc4d0f5b6,"[응용프로그램 개발] C#,Java개발자",제이앤케이씨 서울 금천구,"월급 2,000,000원",[직무내용] 당사는 2011년 창업한 기업으로서 대기업에서 경력의 임원진을 중심으로 스마트팩토리 사업과 스마트팜 사업이 진행되고 있으며 매년 안정적인 성장을 하고 있는 기업입니다. 금번 스마트팜 및 스마트 LBS시스템 개발을...
https://kr.indeed.com/viewjob?jk=8f897aba2bc6b934,소프트웨어 엔지니어,Nexon 성남 분당구,,"Javascript를 이용한 클라이언트 개발이 가능한 분 (jQuery, Ajax 사용 경험 필요) - c#, java 등 1개 이상의 언어 리딩이 가능하신분 - SQLServer, Mysql과 같은 RDBMS 경험..."
https://kr.indeed.com/viewjob?jk=37127548f83bb7f7,[Search & Clova] 네이버 웹검색 연구/개발 경력사원,네이버 대한민국,,를 포함한 머신러닝 패키지 중 한가지를 자신있게 활용할 수 있는 능력 • Linux에서의 개발작업이 익숙하며 Java/Python/C++ 중 한가지 언어를 잘 다루는 능력 [우대사항] • 검색서비스의 수집/정제/랭킹개발업무...
https://kr.indeed.com/viewjob?jk=4181bdc0350b50c7,IT Infra or App. Architecture(해외 금융법인 프로...,디에스파트너즈그룹 서울,,"대졸이상(전공무관) -영어: 중급이상(업무상 소통) -IT경력: UNIX, Java언어 기반 개발 경험 3년 이상 -업무경력:금융사 시스템 개발 또는... 리는점 양해바랍니다 인터넷·IT·통신·모바일·게임>응용프로그래머> JAVA"
https://kr.indeed.com/viewjob?jk=5a0c0234808fcd6d,쇼핑몰 솔루션 개발( PHP 백엔드 및 유지보수),제트앤에스 서울 강남구,"월급 1,600,000원 - 1,800,000원","분야, 연락처, 희망연봉 기재 직무/산업 직무별(직종) 콘텐츠.사이트운영디버깅 웹프로그래머웹프로그래머, ASP, JSP, JAVA, Servlet, CORBA, PHP, CGI, XML 산업별(업종) 통신사.네트워크 웹호스팅"
https://kr.indeed.com/viewjob?jk=c50fe0af6efe2af6,"분자진단, 정밀의학 솔루션 개발자 및 웹 개발자 수시",어큐진 인천 계양구,,담당업무 - Web application 개발 / DB 설계 및 운용 / API 개발 * 필수사항 1. JAVA 2. Spring framework 3. MySQL 4. Linux 서버 운용 * 우대사항 - RESTful...
https://kr.indeed.com/viewjob?jk=6a49ea76da8d2265,"서버개발자(주니어, 시니어)",넥스트매치 서울 서초구,,"서버개발자(주니어, 시니어) - Ruby on Rails 개발자 - PHP/CodeIgniter 개발자 - Java Spring 개발자 - AWS 서비스 운영 경험자 - MySQL, Postgre, Redis 경험자..."
https://kr.indeed.com/viewjob?jk=16af988cd8210617,인사시스템 개발자,카카오 4.2 성남 판교역,,편의를 위한 시스템 개발 및 운영 향후 인사에 대한 인사이트를 제공할 시스템 설계 및 개발 지원자격 Java 기반 웹 애플리케이션 개발 역량을 보유하신 분 (필수) 인사 관련 시스템에 관심이 있는 분 신입 또는 경력...
https://kr.indeed.com/viewjob?jk=7c7f6f9c070d78bd,Robot SW Engineer 그룹 IT인프라 구축,그룹 IT인프라 구축 서울특별시,,등 - Machine Learning 적용 알고리즘 구현 및 운영 - Vision 알고리즘 구현 및 운영 - java 등 다양한 언어로 된 시스템 코드의 개념이해 - 다양한 이해관계자와 Communication Skill...
https://kr.indeed.com/viewjob?jk=b6d8ae980ccf34c8,DX혁신부문 Tech Lab Junior Web & Server Deve...,이투스교육 서울 강남구,,"Development] - 객체지향 프로그래밍에 대한 이해 - 데이타베이스 언어에 대한 이해 - Java, Spring Framework 3.x 이상 환경 Service/API 구현 능력 - RDBMS..."
https://kr.indeed.com/viewjob?jk=a8ed60198075d112,Application Backend Developer,BOEING 서울,,"equivalent experience is required. Proficiency in Java, JavaScript, Python, C#, C++ or comparable Object Oriented Language..."
https://kr.indeed.com/viewjob?jk=4bc853d24fa66e6b,함께할 웹프로그래머를 찾습니다.,성공닷컴 서울 관훈동,,"웹 프로그래머) 관련직종 JAVA 프로그래밍 언어 전문가 직무내용 [ 담당업무 ] - 프로그램 개발/운용/유지보수 - Java, Jsp, Ajax... 워드 [jsp ] [웹프로그램 ] [ java ] [app ] [앱 ] 우대..."
https://kr.indeed.com/viewjob?jk=d351d735c5d3b04a,[엠브레이스] 개발자(JAVA) 경력사원,엠브레이스 서울 구로구,,"기타 담당업무 [엠브레이스] 개발자( JAVA) 경력사원 채용 커리어 양식... 산업 직무별(직종) 웹프로그래머웹프로그래머 응용프로그래머응용프로그래머, Java, Application 시스템프로그래머시스템프로그래머 시스템분석.설계..."
https://kr.indeed.com/viewjob?jk=18d8e70e9d6b8d7d,Senior Engineer (Back-end),Tapjoy 서울,,"interest in Java, and interfacing... Engineering experience (preferably with Java) • Strong knowledge of data structures..."
https://kr.indeed.com/viewjob?jk=1ae9d99acc3fab79,[동영상플랫폼] 동영상 Cloud 플랫폼 개발,네이버 대한민국,,"개발 [역할 ] 전사 LIVE/VOD 클라우드 플랫폼의 서버 개발과 운영 [지원자격 ] - 3년 이상의 JAVA 기반의 서버 개발 경험 [우대사항 ] ※ 우대사항으로, 필수조건은 아닙니다. - Spring Framework..."
https://kr.indeed.com/viewjob?jk=25432db13648cddc,"컨설팅회사 분야별(PMO,PI,ISP, Data Analytics등)컨설...",글로벌 메이저 컨설팅회사 서울 여의도역,"연봉 60,000,000원 - 150,000,000원","이하 응시자격 : - 산업공학, 통계학, 전산학, 경영학, 기타 유사 전공 선호 - 분석(R, Python, SAS, JAVA 등), 시각화(Spotfire, Tableau, Qlik 등), SQL 등 각종 Computer..."
https://kr.indeed.com/viewjob?jk=fdda5613a06f516d,Syrup Wallet Front-End 개발자,SK 플래닛 3.5 성남 판교역,,격에 대한 이해가 있으신 분 - Java 웹 서버 개발 경험이 있으신 분... CSS 등 W3C 웹 표준 규격에 대한 이해 - Spring 등 Java 기반 웹 서비스 개발 및 프레임워크 활용 능력 - Oracle 등...
https://kr.indeed.com/viewjob?jk=c09264c797bbcf54,[TmaxA&C/기술] 기술지원 엔지니어 경력직,티맥스소프트 성남 분당구,,고객사 제품 유지보수 - 프로젝트 수행에 따른 기술 이슈대응 - Cloud Center 운영인력 자격요건 - Java/C 개발자 또는 Unix/Linux 엔지니어 경험자... DB 기술지원 및 사용 경험자 - IT 인프...
https://kr.indeed.com/viewjob?jk=6715e00118ab8fb4,비즈메시지 서비스 운영 총괄 담당자 모집,카엔 성남 삼평동,,"자 - JAVA를 활용한 엔터프라이즈 시스템 구축 및 운영 경험 및 Oracle, Maria, MySQL 등을 활용한 엔터프라이즈 시스템 구축 및 운영 경험이 5년 이상인 자 -DB, System, Server, Java..."
https://kr.indeed.com/viewjob?jk=248488a94314709b,"[대기업] 광고솔루션 개발 과장(PHP, JAVA)",인코리아 프로페셔널 서울 강남구,,JAVA|인터넷·IT·통신·모바일·게임>웹프로그래머>프론트엔드|인터넷·IT·통신·모바일·게임>응용프로그래머>Unix|인터넷·IT·통신·모바일·게임>응용프로그래머>Linux|인터넷·IT·통신·모바일·게임>응용프로그래머> JAVA...
https://kr.indeed.com/viewjob?jk=0ca5a9b1ac697fb3,"[인터랙션플랫폼(댓글, 투표, 공감)] 웹 서비스 개발자",카카오 4.2 성남 판교역,,통해 더 좋은 사용자 경험을 제공하는 서비스를 개발합니다. 지원자격 최소 자격 개발 경력 2년 이상 Java & Spring Framework 기반 웹서비스 개발 경험 Linux 플랫폼에서 웹 서비스 개발/운영 경험...
https://kr.indeed.com/viewjob?jk=74c292088467ca45,JAVA 기반 모바일 웹 서비스 개발,한국사이버결제 서울 구로구,,PAYCO 오더 서비스 개발 및 운영 자격요건 및 우대사항 [지원자격] - 관련분야 경력 2년 이상 - 적극적인 문제해결 능력과 원활한 커뮤니케이션이 가능한 자 - Spring fra-mework 기반 개발 경험자...
https://kr.indeed.com/viewjob?jk=cb4add65c87c626a,1분기 Software Engineer,이스트게임즈 서울 서초구,,"C/C++, C#, Swift, Objective C, Kotlin, Java, JavaScript, Python, Go. - 새로운 프로그래밍... 통신·모바일·게임>응용프로그래머> JAVA|인터넷·IT·통신·모바일·게임..."
https://kr.indeed.com/viewjob?jk=eb4f513eb966fa2a,"공공기관및 연구소 JAVA, JSP 경력자 (외근직포함)",멀틱스 대전 유성구,,"3년이상) 학력 학력무관 성별 무관 기타 담당업무 공공기관및 연구소 JAVA, JSP 경력자모집 (외근직포함) 커리어 양식 지원 아직 커리어에 이력... 무별(직종) 웹프로그래머JSP, JAVA 산업별(업종) 솔루션.ASP.소프..."
https://kr.indeed.com/viewjob?jk=0f5d83cc8815c507,자바(JAVA) 웹개발 경력직,온더아이티 성남 분당구,,엔지니어 웹개발 java [담당업무] 자바( JAVA)개발 [근무부서... 통신·모바일·게임>응용프로그래머> JAVA|인터넷·IT·통신·모바일·게임>웹프로그래머>JSP|인터넷·IT·통신·모바일·게임>웹프로그래머> JAVA
https://kr.indeed.com/viewjob?jk=51649370ed9ac2db,(주)이안소프트 함께 일할 개발자 (내일채움공제가입),이안소프트 서울 성동구,"연봉 25,000,000원 - 27,000,000원","[직무내용] JAVA 프로그램 개발 공공기관, 금융권, 통신사, 일반회사 등 전산업분야를 통틀어 구축함 (응용 프로그램, 솔루션, 등등) 장비는 제공 전공은 무관하지만 반드시 6개월 국비 OR JAVA개발자 과정을 수료해야..."
https://kr.indeed.com/viewjob?jk=66520543e9bb139c,Senior Application Engineer - Technical...,MathWorks 서울,,"e.g. C/C++, .NET, Java... test... languages... C / C++, Python, and Java. Experience with enterprise-scale..."
https://kr.indeed.com/viewjob?jk=b2cfcc7d4b79c216,[Search&Clova] Clova 챗봇 Platform 개발 신입/경...,네이버 대한민국,,"머신러닝 모델의 서비스화 [ 자격요건] - 기술 경험 · Scala/ Java 등으로 웹 어플리케이션 또는 이에 지식과 경험 · DB Schema... Programming Skill · Java, Scala, Spark..."
https://kr.indeed.com/viewjob?jk=1181e442ee6f5fd2,[배민서비스실] 안드로이드 개발자,우아한 형제들 서울 송파구,,"도전을 같이 하실 분들을 찾습니다. [개발환경] - 사용 언어: Java / Kotlin - 주요 라이브러리: RxJava2, Retrofit2... 안드로이드 개발 경력 3년 이상 - Java 또는 Kotlin 개발 언어에..."
https://kr.indeed.com/viewjob?jk=a0427584e85a0d53,안드로이드 개발자,myrealtrip 서울,,https://bit.ly/2MWrloq [자격요건] 3년 이상의 Android 개발 경험이 있으신 분 Java 언어에 대한 이해와 Kotlin 으로 개발 경험을 보유하신 분 기술적 문제에 대한 토론과 코드리뷰에 거부감이...
https://kr.indeed.com/viewjob?jk=0439e4c33c0b9965,"모의해킹/해킹보안/회계,세무 무료교육(초보자 지원가능)",한국디지털융합직업전문학교 서울 중랑구,"연봉 26,000,000원","한국디지털융합직업전문학교 | 교육서비스,멀티미디어,정보서비스 | 사무·회계 기타, java,서버관리,네트워크관리,웹프로그래머,응용프로그래머,시스템프로그래머,컨텐츠관리,블로그관리 | 정규직,계약직 | 1년이상 | 월~금 | 오전..."
https://kr.indeed.com/viewjob?jk=5eac38e6882515b7,하드웨어 및 소프트웨어 개발 직원,아이벡스메디칼시스템즈 강원도 원주,"연봉 30,000,000원 - 32,000,000원",가능 [장애인채용희망여부] 비희망 [병역특례] - 비희망 인터넷·IT·통신·모바일·게임>응용프로그래머>C·C++|인터넷·IT·통신·모바일·게임>응용프로그래머> JAVA|인터넷·IT·통신·모바일·게임>응용프로그래머>C#
https://kr.indeed.com/viewjob?jk=f2f9d7e5c715ec11,[EY컨설팅] 컨설팅본부(Advisory) Java 개발자 경력직 모집,EY 4.0 대한민국,,"가지고 탁월한 고객 서비스를 제공하고 있습니다. 모집 분야 : [EY컨설팅] 컨설팅본부(Advisory) Java 개발자 경력직 모집 지원자격 자바를 사용할 줄 알고, 객체 지향 언어에 대한 이해가 있으신 분 전산학에..."
https://kr.indeed.com/viewjob?jk=d66914db200312e0,TECH U Associate Solutions Architect - 2...,Amazon Web Services Korea LLC 서울,,"programming languages: Java, Python, Ruby... Balancing), or programming (Node.JS, Java, Ruby, C#, Python, or PHP) · Demonstrated..."
https://kr.indeed.com/viewjob?jk=172ddad6a550249e,소프트웨어 개발 경력자,이에이치 고양 덕양구,"연봉 24,000,000원 - 26,000,000원","지원자격 경력 신입·경력 학력 - 성별 무관 기타 담당업무 / 소프트웨어 개발(연구개발) / JAVA, ORACLE, 웹 프로그램 개발 / 주5일근무 ( 09:00~17:00 ) / 연 2,500 ~ 연 4,500만원 상세..."
https://kr.indeed.com/viewjob?jk=f0c61e659e288a89,LINE TV 개발 경력사원,네이버 대한민국,,"서비스 개발 [필요역량] - Java 기반 백엔드 프로그래밍 기본 지식을... 패턴, 대용량 데이터 설계 및 활용에 대한 기본 지식을 가지신 분 - Java 중급 이상, 글로벌 서비스 운영 및 개발 경험자 - 웹 프로토콜 및..."
https://kr.indeed.com/viewjob?jk=37f9180a5ed0543a,개발 담당자,지오비전 강원도 춘천,,등에 대해 배울 수 있는 기회 제공 - 대학원 석사 과정 지원 인터넷·IT·통신·모바일·게임>응용프로그래머>C·C++|인터넷·IT·통신·모바일·게임>응용프로그래머> JAVA|인터넷·IT·통신·모바일·게임>응용프로그래머>C#
https://kr.indeed.com/viewjob?jk=39834f5337a56072,Sr. Data Architect - Data Lakes & Analyt...,Amazon Web Services Korea LLC 서울,,"software code in one or more programming languages ( Java, JavaScript, Python, etc). · Current hands-on implementation..."
https://kr.indeed.com/viewjob?jk=3190803dba63c314,동영상 데이터/비즈 플랫폼 서버 개발자,카카오 4.2 성남 판교역,,"동영상 비즈 플랫폼 개발 동영상 광고 서버 개발 동영상 데이터 수집/분석 지원자격 기본 조건 Java 개발 경력 2년 이상 Spring Framework 기반 웹 애플리케이션 개발 경험 MySQL, MongoDB 등의..."
https://kr.indeed.com/viewjob?jk=513439fc200c379a,[멜론] 플랫폼 개발자 (경력),카카오 4.2 성남 판교역,,멜론 벡엔드 시스템 구조 개선 지원자격 필요 기술 셋 및 지원 자격(경력) -Linux/ Java/Oracle(Mysql)/Git 기반 혹은 그에 준하는 언어로 서버 개발이 가능하신 분 -Springframework...
https://kr.indeed.com/viewjob?jk=bc20dd55a7092a29,국민카드 시스템 개발 및 유지보수,강한코딩랩 서울 송파구,"월급 2,000,000원 - 2,200,000원","연락처, 희망연봉 기재 직무/산업 직무별(직종) 콘텐츠.사이트운영디버깅 웹프로그래머웹프로그래머, ASP, JSP, JAVA, Servlet, CORBA, PHP, CGI, XML 산업별(업종) 컴퓨터.하드웨어.주변기기 컴퓨터"
https://kr.indeed.com/viewjob?jk=2f8a48b7f26e5569,Main Controller Developer (SW Engineer),Applied Materials Inc. 경기도 화성,,"complex multidisciplinary Java system Characterize, design and develop capabilities in complex multidisciplinary Java system..."
https://kr.indeed.com/viewjob?jk=e7861966e41789e5,정보보안 제품 개발 및 구축 경력 (3년차 이상),파로스인포 서울 강서구,"연봉 36,000,000원 - 38,000,000원",및 엔지니어링 지원자 - 인증 및 접근제어 관련 제품 구축 기술지원 및 개발 경험 우대 - Java 또는 .net 개발 경험자 - OS/System/Network/Database 관련 경험 - ActiveDirectory...
https://kr.indeed.com/viewjob?jk=b6d8ae980ccf34c8,DX혁신부문 Tech Lab Junior Web & Server Deve...,이투스교육 서울 강남구,,"Development] - 객체지향 프로그래밍에 대한 이해 - 데이타베이스 언어에 대한 이해 - Java, Spring Framework 3.x 이상 환경 Service/API 구현 능력 - RDBMS..."
https://kr.indeed.com/viewjob?jk=2d645980f2db02ca,정보기술연구소 자바(JAVA) 연구개발자,온더아이티 성남 분당구,,엔지니어 웹개발 java [담당업무] 자바( JAVA)연구개발 [근무부... 통신·모바일·게임>응용프로그래머> JAVA|인터넷·IT·통신·모바일·게임>웹프로그래머>JSP|인터넷·IT·통신·모바일·게임>웹프로그래머> JAVA
https://kr.indeed.com/viewjob?jk=75a4d05b001bf451,웹 개발자,Nexon 성남 분당구,,"운영 - 포털 서비스 개발 및 운영 지원자격 - 경력에 준하는 웹 개발 기본 지식을 보유 하신 분 - 웹언어 ( Java, PHP 등)을 이용한 Back-End 개발 경력이 3년 이상 또는 그에 준하는 능력을 보유하신 분..."
